{
  "contractVersion": "1.0",
  "conceptId": "l1.nudity",
  "displayName": "Nudity",
  "layer": 1,
  "enabled": true,
  "looksLike": [
    "nudity"
  ],
  "butNot": [
    "a person in swimwear at a beach",
    "a classical statue"
  ],
  "scope": "wholeElement",
  "coverStyle": "solid",
  "showLabel": false,
  "sensitive": true
}
